data/grupo_06_limpio.csv

hogar_id,barrio,consumo_m3_mes,personas_hogar,consumo_excesivo
A001,La Isleta,59.0,8,1
A002,El Prado,7.2,5,0
A003,La Isleta,11.8,5,0
A004,El Prado,30.5,8,0
A005,El Prado,58.0,5,1
A006,San Jerónimo,12.6,3,0
A007,El Prado,22.9,4,0
A008,San Jerónimo,15.5,2,1
A009,La Isleta,22.7,3,0
A010,Santa Ana,8.0,5,0
A011,Santa Ana,40.0,7,0
A012,Santa Ana,8.8,3,0
A013,Ortez,58.6,7,1
A014,Santa Ana,13.3,6,0
A015,San Jerónimo,21.2,1,1
A016,El Prado,7.8,5,0
A017,Ortez,44.2,5,1
A018,El Prado,27.0,2,1
A019,San Jerónimo,33.5,8,0
A020,Santa Ana,43.0,2,1
A021,Ortez,7.4,3,0
A022,Santa Ana,19.3,7,0
A023,Santa Ana,28.0,6,0
A024,El Prado,10.1,7,0
A025,La Isleta,9.5,4,0
A026,San Jerónimo,5.2,7,0
A027,Ortez,43.4,3,1
A028,Santa Ana,30.5,4,1
A029,El Prado,53.7,3,1
A030,Ortez,12.7,6,0
A031,San Jerónimo,26.5,3,1
A032,Ortez,58.9,6,1
A033,El Prado,15.8,7,0
A034,Ortez,22.8,5,1
A035,La Isleta,59.7,4,1
A036,San Jerónimo,53.9,1,1
A037,Ortez,53.7,4,1
A038,San Jerónimo,18.7,5,0
A039,El Prado,54.7,8,0
A040,San Jerónimo,19.8,4,0
A041,San Jerónimo,34.7,3,1
A042,San Jerónimo,42.6,6,0
A043,Santa Ana,46.9,5,1
A044,Ortez,13.5,8,0
A045,El Prado,52.7,7,1
A046,Ortez,10.7,5,0
A047,Santa Ana,43.7,1,1
A048,Ortez,49.5,7,1
A049,La Isleta,6.1,5,0
A050,Ortez,30.5,7,0
A051,El Prado,31.0,6,1
A052,La Isleta,30.5,2,1
A053,San Jerónimo,18.9,5,0
A054,Ortez,52.8,6,1
A055,Ortez,59.5,4,1
A056,Ortez,11.4,4,1
A057,Santa Ana,58.2,7,1
A058,La Isleta,25.5,6,0
A059,El Prado,36.3,2,1
A060,Santa Ana,27.1,6,0
A061,La Isleta,41.8,5,1
A062,San Jerónimo,17.0,2,1
A063,Ortez,47.9,4,1
A064,El Prado,25.6,8,0
A065,Santa Ana,34.7,4,1
A066,La Isleta,58.6,6,1
A067,Santa Ana,12.3,1,1
A068,Santa Ana,32.3,2,1
A069,El Prado,56.2,5,1
A070,San Jerónimo,48.5,2,1
A071,La Isleta,59.8,4,1
A072,La Isleta,43.6,6,1
A073,San Jerónimo,46.1,3,1
A074,San Jerónimo,28.3,4,0
A075,El Prado,20.1,3,0
A076,San Jerónimo,37.5,2,1
A077,El Prado,31.0,5,1
A078,El Prado,22.5,6,0
A079,La Isleta,30.1,3,1
A080,El Prado,48.1,5,1

README.md

## 4. Visualización con Seaborn (Tarea 4 - 0.6 pts)

2. **`data/comparacion.png` (Gráfico 2: Diagrama de Cajas de Consumo según Clasificación):**
   - **Configuración:** Generado con `sns.boxplot()`. Eje X: Clasificación de exceso (0: Normal, 1: Excesivo); Eje Y: Consumo mensual (m³/mes).
   - **Qué muestra y conclusión:** La mediana del consumo mensual para la clase normal se ubica en **18.8 m³** (con rango intercuartílico entre 10.7 y 25.6 m³), mientras que para la clase de consumo excesivo la mediana asciende a **47.9 m³** (con rango intercuartílico entre 37.5 y 56.2 m³). La diferencia entre las medianas muestra que los hogares clasificados con consumo excesivo presentan, en general, consumos mensuales más elevados; sin embargo, existe un área de solapamiento en consumos intermedios (25–35 m³) donde el número de habitantes resulta determinante para definir la clasificación.